{
  "installation": {
    "id": "DEMO-MILL-01",
    "name": "Demo Steel Mill (illustrative)",
    "country": "IN",
    "unLocode": "INMAA",
    "productionRoute": "BF-BOF",
    "routeParameters": { "bfCokeRate": 0.45, "scrapRatio": 0.0 }
  },
  "reportingPeriod": 2026,
  "production": { "cnCode": "72083900", "activityLevelTonnes": 1000000 },
  "sourceStreams": [
    {
      "name": "Metallurgical coal",
      "activityData": 550000,
      "unit": "t",
      "ncvTJPerUnit": 0.028,
      "emissionFactorTCO2PerTJ": 95,
      "oxidationFactor": 0.99
    },
    {
      "name": "Natural gas",
      "activityData": 5000,
      "unit": "TJ",
      "emissionFactorTCO2PerTJ": 56,
      "oxidationFactor": 1.0
    }
  ],
  "electricity": { "mwh": 250000, "emissionFactorTCO2PerMWh": 0.71, "contractualFactor": false },
  "precursors": [],
  "result": {
    "directTCO2": 1728370,
    "indirectTCO2": 177500,
    "seeTCO2PerTonne": 1.90587,
    "determination": "actual"
  }
}
